GEOID,place_name,state_abbr,pop_2020,adoption_year,year_found,search_class,obyrne_label,adopt_by2012,status_final,audit_note,source_type,evidence_note
0151000,Montgomery city,AL,200041,unknown,,unknown,adopted_by2012,1.0,adopted_year_unknown,,official,City of Montgomery's official website confirms 311 service exists for non-emergency city services but no source specifies the original launch year.
2634000,Grand Rapids city,MI,198707,2013,2013.0,year_found,not_adopted_by2012,0.0,adopted_year_verified,,news,"GR311 went live on October 1, 2013, per Rapid Growth Media reporting."
0636000,Huntington Beach city,CA,198405,no_311,,no_311,not_adopted_by2012,0.0,not_adopted,,official,Huntington Beach uses a direct non-emergency police number for non-emergency service requests; no 311 system was found.
1270600,Tallahassee city,FL,197933,no_311,,no_311,not_adopted_by2012,0.0,not_adopted,,official,Tallahassee uses the DigiTally app and a direct CDA non-emergency number for service requests; no 311 system was found.
2053775,Overland Park city,KS,197734,unknown,,unknown,not_adopted_by2012,0.0,adopted_year_unknown,,official,"Overland Park has the OPCares citizen service portal, but no specific launch year was found in available sources."
4845744,McKinney city,TX,197497,unknown,,unknown,not_in_obyrne,,adopted_year_unknown,,official,No evidence of a formal dedicated 311 system was found for McKinney; city uses departmental contacts for non-emergency service requests.
4830464,Grand Prairie city,TX,196255,2022,2022.0,year_found,not_adopted_by2012,0.0,adopted_year_verified,,official,"Grand Prairie launched its 311 service on April 19, 2022, per a city press release."
0630000,Glendale city,CA,195934,no_311,,no_311,not_adopted_by2012,0.0,not_adopted,,official,"Glendale CA uses a direct ""City Service Line"" (818-550-4400) for non-emergency requests; no 311 number or system was found."
1210275,Cape Coral city,FL,195422,unknown,,unknown,not_adopted_by2012,0.0,adopted_year_unknown,,official,Cape Coral has a 311 call center with a software update in 2022; the original launch year could not be confirmed.
4659020,Sioux Falls city,SD,193437,2019,2019.0,year_found,not_adopted_by2012,0.0,adopted_year_verified,,official,"Sioux Falls launched the OneLink 311 mobile app in 2019, celebrating its first anniversary in March 2020."
0454050,Peoria city,AZ,191997,no_311,,no_311,not_adopted_by2012,0.0,not_adopted,,official,Peoria AZ uses MyPeoriaAZ app and a direct non-emergency number for service requests; no 311 system was found.
4740000,Knoxville city,TN,191446,2005,2005.0,year_found,adopted_by2012,1.0,adopted_year_verified,,official,"City of Knoxville's official 311 page confirms the service launched in May 2005, operated by the Center for Service Innovation, and was the eighth 311 system to go live in the nation."
5374060,Vancouver city,WA,191278,2015,2015.0,year_found,not_adopted_by2012,0.0,adopted_year_verified,,news,"CRESA soft-launched the 311 non-emergency service for Vancouver WA in September 2015, per The Columbian."
4459000,Providence city,RI,190745,2017,2017.0,year_found,adopted_by2012,1.0,adopted_year_verified,,official,City of Providence official press release documents Mayor Elorza launching the 3-1-1 hotline and PVD311 mobile app through the Mayor's Center for City Services in 2017.
3901000,Akron city,OH,190146,2017,2017.0,year_found,adopted_by2012,1.0,adopted_year_verified,,news,"Signal Akron reports Akron's 311 phone hotline and website launched in 2017; MyAkron311 mobile app was added in January 2024 (note: O'Byrne 2015 flags Akron as adopted by 2012, possibly reflecting a predecessor call-center service)."
4810768,Brownsville city,TX,187004,no_311,,no_311,not_adopted_by2012,0.0,not_adopted,,official,Brownsville operates a 546-HELP non-emergency line instead of 311 for non-emergency service requests.
2270000,Shreveport city,LA,186848,unknown,,unknown,not_adopted_by2012,0.0,adopted_year_unknown,,news,"Shreveport has a 311 service; a ""Port City 311"" app launched in October 2024, but the original 311 launch year could not be confirmed."
0150000,Mobile city,AL,186621,unknown,,unknown,adopted_by2012,1.0,adopted_year_unknown,,official,"City of Mobile official 311 page confirms the service exists but does not state a launch year; a November 2011 GCN article references adding a mobile app to Mobile's existing 311 system, suggesting launch was at or before 2011."
5156000,Newport News city,VA,186047,2013,2013.0,year_found,not_adopted_by2012,0.0,adopted_year_verified,,news,"Newport News 311 Contact Center opened in March 2013, per the Oyster Pointer."
0473000,Tempe city,AZ,185328,2012,2012.0,year_found,not_adopted_by2012,0.0,conflict_fp,FP-conflict: search found year 2012 but O'Byrne (2012 survey) says not adopted. Verify source.,news,Tempe 311 is described as an existing service by a June 2012 news article; the mobile app launched in 2013.
1224000,Fort Lauderdale city,FL,182892,unknown,,unknown,unclear,,adopted_year_unknown,,official,Fort Lauderdale uses the LauderServ/311 portal for non-emergency service requests; no original launch year was found.
4714000,Chattanooga city,TN,181568,2003,2003.0,year_found,adopted_by2012,1.0,adopted_year_verified,,news,"Chattanooga Times Free Press reports that Chattanooga launched its 311 Service Center on February 6, 2003, making it one of the first mid-size US cities to implement a ""One Call to City Hall"" program."
1703012,Aurora city,IL,180215,2025,2025.0,year_found,not_adopted_by2012,0.0,adopted_year_verified,,news,"Aurora IL officially launched myAurora 311 on March 11, 2025, per Shaw Local reporting."
0670098,Santa Rosa city,CA,177959,no_311,,no_311,not_adopted_by2012,0.0,not_adopted,,official,Santa Rosa uses direct department phone numbers and a citizen permit portal for service requests; no 311 system was found.
4123850,Eugene city,OR,177428,no_311,,no_311,not_adopted_by2012,0.0,not_adopted,,official,Eugene uses a non-emergency phone number (541-682-5111) for service requests and does not operate a 311 system.
0622020,Elk Grove city,CA,176569,unknown,,unknown,not_in_obyrne,,adopted_year_unknown,,official,Elk Grove uses SeeClickFix for citizen issue reporting; no specific launch year was found.
4164900,Salem city,OR,175942,no_311,,no_311,not_adopted_by2012,0.0,not_adopted,,official,Salem OR uses a non-emergency phone number (503-588-6123) and online reporting; no 311 system was found.
0653896,Ontario city,CA,175712,unknown,,unknown,not_adopted_by2012,0.0,adopted_year_unknown,,official,"Ontario CA has a 311 service for non-emergency requests, but no specific launch year was found in available sources."
3710740,Cary town,NC,174778,2020,2020.0,year_found,not_in_obyrne,,adopted_year_verified,,official,"311Cary launched on January 2, 2020 as the first 311 system in the Triangle area, per a Town of Cary press release."
0659451,Rancho Cucamonga city,CA,174683,no_311,,no_311,not_adopted_by2012,0.0,not_adopted,,official,Rancho Cucamonga uses the RC2GO app for issue reporting; no 311 phone number or system was found.
0653322,Oceanside city,CA,173965,unknown,,unknown,not_adopted_by2012,0.0,adopted_year_unknown,,official,Oceanside uses SeeClickFix for citizen reporting but directs non-emergency calls to the police non-emergency line; no formal 311 launch year was found.
0640130,Lancaster city,CA,173094,unknown,,unknown,not_adopted_by2012,0.0,adopted_year_unknown,,official,"Lancaster uses the ""Inform Lancaster"" app for service requests; no 311 number or launch year was found."
0629000,Garden Grove city,CA,171863,unknown,,unknown,not_adopted_by2012,0.0,adopted_year_unknown,,official,Garden Grove uses SeeClickFix for citizen reporting; no dedicated 311 number or launch year was found.
1255775,Pembroke Pines city,FL,171073,unknown,,unknown,unclear,,adopted_year_unknown,,official,Pembroke Pines uses SeeClickFix for citizen service requests; no dedicated 311 number or launch year was found.
0827425,Fort Collins city,CO,169982,2011,2011.0,year_found,not_adopted_by2012,0.0,conflict_fp,FP-conflict: search found year 2011 but O'Byrne (2012 survey) says not adopted. Verify source.,news,"""Access Fort Collins"" citizen service system was created in 2011, per Rocky Mountain Collegian reporting."
2970000,Springfield city,MO,169177,unknown,,unknown,not_adopted_by2012,0.0,adopted_year_unknown,,official,Springfield MO has a Citizen Resource Center (417-864-1010) and GoSpringfieldMO app for service requests; no formal 311 launch year was found.
0655156,Palmdale city,CA,168895,no_311,,no_311,not_adopted_by2012,0.0,not_adopted,,official,No 311 system was found for Palmdale; city uses direct department phone numbers for service requests.
4715160,Clarksville city,TN,167509,2017,2017.0,year_found,not_adopted_by2012,0.0,adopted_year_verified,,official,Clarksville TN launched its 311 system in 2017.
0664224,Salinas city,CA,163391,unknown,,unknown,not_adopted_by2012,0.0,adopted_year_unknown,,official,Salinas has a 311 portal on the Qscend platform; no specific launch year was found.
0633000,Hayward city,CA,162666,unknown,,unknown,not_adopted_by2012,0.0,adopted_year_unknown,,official,"Hayward has an ""Access Hayward"" citizen service system; no specific launch year was found."
3457000,Paterson city,NJ,159323,unknown,,unknown,not_adopted_by2012,0.0,adopted_year_unknown,,official,Paterson uses SeeClickFix for citizen service requests; no dedicated 311 number or launch year was found.
5101000,Alexandria city,VA,159139,2020,2020.0,year_found,not_adopted_by2012,0.0,adopted_year_verified,,news,"Alex311 launched in February 2020, replacing the prior Call.Click.Connect system, per ALXnow reporting."
0616350,Corona city,CA,157468,unknown,,unknown,not_adopted_by2012,0.0,adopted_year_unknown,,official,Corona operates a Citizen 311 portal (311.coronaca.gov); no specific launch year was found in available sources.
1349008,Macon-Bibb County,GA,157035,2012,2012.0,year_found,not_in_obyrne,,adopted_year_verified,,news,"Macon-Bibb County launched SeeClickFix in April 2012 as a 311-style citizen service request system, funded by a $5,000 Knight Fund grant."
2036000,Kansas City city,KS,156298,unknown,,unknown,not_in_obyrne,,adopted_year_unknown,,official,The Unified Government of Wyandotte County and Kansas City KS operates a 311 Call Center; expanded to 24/7 service in 2021 but original launch year not verifiable.
0843000,Lakewood city,CO,156247,unknown,,unknown,not_adopted_by2012,0.0,adopted_year_unknown,,official,Lakewood operates MyLakewood311 for citizen service requests; no specific launch year was found.
2567000,Springfield city,MA,155280,2008,2008.0,year_found,adopted_by2012,1.0,adopted_year_verified,,official,City of Springfield official document (March 2009 CitiStat report) states the 311 Center was created in September 2008; Springfield was the first community in western Massachusetts to use the 3-1-1 number.
0677000,Sunnyvale city,CA,155250,unknown,,unknown,not_adopted_by2012,0.0,adopted_year_unknown,,secondary,"Sunnyvale uses SeeClickFix for citizen service requests with activity dating to at least 2017, but no specific launch year was found."
4751560,Murfreesboro city,TN,153757,unknown,,unknown,not_in_obyrne,,adopted_year_unknown,,official,No evidence of a formal 311 system in Murfreesboro; city lists departmental contacts but no dedicated 311 service or launch year was found.
4839148,Killeen city,TX,153735,unknown,,unknown,not_in_obyrne,,adopted_year_unknown,,official,Killeen operates killeen311.com and the Killeen Connect app (SeeClickFix) for service requests; no specific launch year was found.
2836000,Jackson city,MS,152997,2011,2011.0,year_found,adopted_by2012,1.0,adopted_year_verified,,news,"Jackson Free Press reported April 4, 2011 that Mayor Harvey Johnson Jr. launched the city's 311 system with six employees taking calls from the Eudora Welty Library after the state PSC approved use of the 3-1-1 number."
1232000,Hollywood city,FL,152802,unknown,,unknown,unclear,,adopted_year_unknown,,official,City of Hollywood FL provides customer services online but no dedicated 311 system or specific launch year was found.
5305210,Bellevue city,WA,151780,2013,2013.0,year_found,not_adopted_by2012,0.0,adopted_year_verified,,official,"Bellevue launched the MyBellevue app and citizen request portal in 2013, handling requests for streetlights, potholes, and other city issues."
4856000,Pasadena city,TX,151368,no_311,,no_311,not_adopted_by2012,0.0,not_adopted,,official,No dedicated 311 system was found for Pasadena TX; city uses departmental phone numbers and online contacts.
0622804,Escondido city,CA,151014,unknown,,unknown,not_adopted_by2012,0.0,adopted_year_unknown,,official,"Escondido uses the ""Report It!"" (CitySourced) online reporting system; no dedicated 311 number and no launch year was found."
0658072,Pomona city,CA,150984,no_311,,no_311,not_adopted_by2012,0.0,not_adopted,,official,Pomona CA uses a traditional non-emergency dispatch number (909-622-1241) and departmental contacts; no dedicated 311 system was identified.
4513330,Charleston city,SC,150872,unknown,,unknown,not_in_obyrne,,adopted_year_unknown,,official,"Charleston operates a Citizen Services Desk reachable at 843-724-7311, but no specific launch year for the service was found."
1738570,Joliet city,IL,150251,2021,2021.0,year_found,not_adopted_by2012,0.0,adopted_year_verified,,official,"City of Joliet launched CitizenVUE, a citizen engagement service request app, on April 7, 2021, replacing prior service request methods."
4847892,Mesquite city,TX,149627,no_311,,no_311,not_adopted_by2012,0.0,not_adopted,,official,No dedicated 311 system was found for Mesquite TX; city uses traditional non-emergency departmental phone numbers.
1751622,Naperville city,IL,149419,no_311,,no_311,not_adopted_by2012,0.0,not_adopted,,official,"No citywide 311 system was found for Naperville; the park district uses a ""311 Parks"" internal tracking system (2018) but there is no city-operated 311 line."
1765000,Rockford city,IL,148670,unknown,,unknown,not_adopted_by2012,0.0,adopted_year_unknown,,secondary,"ICMA documents reference Rockford IL 311 Call Center Services and the city has a Customer Service department, but no specific launch year was found."
0662938,Roseville city,CA,148516,unknown,,unknown,not_in_obyrne,,adopted_year_unknown,,official,Roseville operates a myRSVL service request portal for residents; no specific launch year was found.
0908000,Bridgeport city,CT,147717,2012,2012.0,year_found,not_adopted_by2012,0.0,conflict_fp,FP-conflict: search found year 2012 but O'Byrne (2012 survey) says not adopted. Verify source.,news,"Bridgeport launched the BConnected citizen reporting app in 2012 under Mayor Finch; replaced in 2016 by ""Bridgeport 311"" (SeeClickFix) under Mayor Ganim."
1369000,Savannah city,GA,147456,2006,2006.0,year_found,adopted_by2012,1.0,adopted_year_verified,,news,"The Savannah Tribune states ""Launched in 2006, 311 is designed to make City services more accessible to citizens,"" describing 311 as a central non-emergency contact replacing numerous individual department numbers."
3673000,Syracuse city,NY,146726,unknown,,unknown,not_adopted_by2012,0.0,adopted_year_unknown,,official,Syracuse operates SYRCityline (SeeClickFix) for citizen service requests; a new mobile app launched in August 2021 but the original service launch year was not found.
0680000,Torrance city,CA,146442,no_311,,no_311,not_adopted_by2012,0.0,not_adopted,,official,No dedicated 311 system was found for Torrance CA; city lists departmental contacts without a unified 311 service.
0471510,Surprise city,AZ,144407,unknown,,unknown,not_in_obyrne,,adopted_year_unknown,,official,"Surprise operates the ""My Surprise"" app (CitySourced) for citizen service requests; no specific launch year was found."
0628000,Fullerton city,CA,143267,no_311,,no_311,not_adopted_by2012,0.0,not_adopted,,official,No dedicated 311 system was found for Fullerton CA; city uses a service request form via Public Works (714-738-6897) but no 311 service.
4845384,McAllen city,TX,142404,unknown,,unknown,not_adopted_by2012,0.0,adopted_year_unknown,,official,McAllen operates a 311 call center and mobile app (CitySourced) for citizen requests; no specific launch year was found.
1225175,Gainesville city,FL,142245,2015,2015.0,year_found,not_in_obyrne,,adopted_year_verified,,news,"WUFT news article (July 22, 2015) reports the City of Gainesville launched its 311GNV online and mobile non-emergency reporting service on that date; later rebranded as myGNV in 2019 (note: Socrata lower bound was 2016, consistent with post-launch open data publication)."
0877290,Thornton city,CO,142185,unknown,,unknown,not_in_obyrne,,adopted_year_unknown,,official,"Thornton operates ""My Thornton"" on the Qscend 311 platform for citizen service requests; no specific launch year was found."
0682954,Visalia city,CA,141771,unknown,,unknown,not_in_obyrne,,adopted_year_unknown,,official,Visalia has a dedicated 311 Department with its own city website section; no specific launch year was found.
2052575,Olathe city,KS,141586,unknown,,unknown,not_adopted_by2012,0.0,adopted_year_unknown,,official,Olathe operates OlatheConnect as a 24/7 virtual city hall service request system; active as of 2019 but no launch year was found.
4819972,Denton city,TX,141107,2025,2025.0,year_found,not_in_obyrne,,adopted_year_verified,,official,"City of Denton officially launched its 311 Contact Center on April 21, 2025 as a 24/7 single point of contact for non-emergency city services."
4876000,Waco city,TX,140541,unknown,,unknown,not_adopted_by2012,0.0,adopted_year_unknown,,official,Waco operates MyWaco Central (CitySourced) for citizen service requests; no specific launch year for a formal 311 system was found.
4983470,West Valley City city,UT,139973,no_311,,no_311,not_adopted_by2012,0.0,not_adopted,,official,No dedicated 311 system was found for West Valley City UT; city uses departmental phone contacts and a general contact form.
0653980,Orange city,CA,139451,unknown,,unknown,not_adopted_by2012,0.0,adopted_year_unknown,,official,"City of Orange operates ""Orange 24/7"" app for service requests; no launch year or evidence of a formal 311 phone number was found."
2684000,Warren city,MI,139122,unknown,,unknown,not_adopted_by2012,0.0,adopted_year_unknown,,official,"Warren operates ""311Warren"" on the Qscend platform for citizen service requests; no specific launch year was found."
0656000,Pasadena city,CA,138462,2009,2009.0,year_found,not_adopted_by2012,0.0,conflict_fp,FP-conflict: search found year 2009 but O'Byrne (2012 survey) says not adopted. Verify source.,news,"Pasadena launched its 311 Citizen Service Center on January 24, 2009, handling approximately 75,000 calls annually."
1912000,Cedar Rapids city,IA,137758,unknown,,unknown,not_adopted_by2012,0.0,adopted_year_unknown,,official,"Cedar Rapids operates ""My CR"" for non-emergency service requests; no specific 311 launch year was found."
3921000,Dayton city,OH,137496,2014,2014.0,year_found,not_adopted_by2012,0.0,adopted_year_verified,,news,"Dayton launched the ""Dayton Delivers"" non-emergency service request app in January 2014 following a late-2013 resident beta test."
5135000,Hampton city,VA,137280,unknown,,unknown,adopted_by2012,1.0,adopted_year_unknown,,secondary,"A February 2002 Connecticut General Assembly report lists Hampton VA among jurisdictions already operating a 311 system, noting Hampton was the first locality in Virginia to launch a centralized 311 call center; exact launch year not found."
3421000,Elizabeth city,NJ,136677,no_311,,no_311,not_adopted_by2012,0.0,not_adopted,,official,No dedicated 311 system was found for Elizabeth NJ; city lists departmental contacts without a unified 311 service.
5335415,Kent city,WA,136592,unknown,,unknown,not_in_obyrne,,adopted_year_unknown,,official,"Kent operates the ""KentWorks"" app for non-emergency citizen service requests; no specific launch year was found."
4516000,Columbia city,SC,136195,2012,2012.0,year_found,adopted_by2012,1.0,adopted_year_verified,,news,"The Columbia Star reports that starting July 1, 2012 the City of Columbia launched its Customer Care Center with a 24-hour hotline at 545-3300, to which all local 311 calls in the Midlands are forwarded."
0973000,Stamford city,CT,135462,unknown,,unknown,not_adopted_by2012,0.0,adopted_year_unknown,,official,Stamford has a Citizen's Service Bureau with a FixIt portal for service requests; no specific 311 launch year was found.
0682590,Victorville city,CA,134638,2025,2025.0,year_found,not_in_obyrne,,adopted_year_verified,,news,"Victorville launched the ""Victorville NOW"" app for non-emergency service requests in July 2025, per Victor Valley News."
1245975,Miramar city,FL,134516,unknown,,unknown,not_in_obyrne,,adopted_year_unknown,,official,Miramar uses SeeClickFix for citizen service requests; no specific launch year was found.
1214400,Coral Springs city,FL,134168,unknown,,unknown,unclear,,adopted_year_unknown,,official,"Coral Springs has a ""My Coral Springs"" service request portal; no specific launch year was found."
2676460,Sterling Heights city,MI,134059,unknown,,unknown,not_adopted_by2012,0.0,adopted_year_unknown,,secondary,"Sterling Heights uses SeeClickFix (""Sterling Connect"") for service requests; no specific launch year was found."
4813024,Carrollton city,TX,133552,no_311,,no_311,not_adopted_by2012,0.0,not_adopted,,official,Carrollton TX uses a non-emergency line (972-466-3333) and SeeClickFix for service requests; no formal 311 branding or system was found.
4848072,Midland city,TX,132890,2024,2024.0,year_found,not_in_obyrne,,adopted_year_verified,,news,"Midland launched SeeClickFix for citizen requests in mid-2024; the City of Midland Facebook page confirmed 13,000+ requests responded to since launch."
0952000,New Haven city,CT,129757,unknown,,unknown,not_adopted_by2012,0.0,adopted_year_unknown,,news,New Haven aldermen approved a 311 hotline in October 2007; the actual launch date of the service could not be confirmed from available sources.
0669084,Santa Clara city,CA,128588,unknown,,unknown,not_adopted_by2012,0.0,adopted_year_unknown,,official,"Santa Clara has the ""MySantaClara"" app for citizen service requests; no 311 phone number or launch year was found."
4052500,Norman city,OK,128161,no_311,,no_311,not_in_obyrne,,not_adopted,,official,Norman OK uses an Action Center phone/portal (405-366-5396) for service requests; no formal 311 system was found.
0678582,Thousand Oaks city,CA,126824,unknown,,unknown,not_adopted_by2012,0.0,adopted_year_unknown,,official,Thousand Oaks uses MaintStar Mobile Citizen and SeeClickFix for service requests; no specific launch year or formal 311 number was found.
2071000,Topeka city,KS,126437,2025,2025.0,year_found,not_adopted_by2012,0.0,adopted_year_verified,,news,"Topeka announced and rolled out a new 311 hotline on March 25, 2025, per KSNT news; previously used SeeClickFix CRM."
4842508,Lewisville city,TX,126422,unknown,,unknown,not_in_obyrne,,adopted_year_unknown,,official,"Lewisville uses the ""ourLewisvilleTX"" app (CitySourced) for service requests; no specific launch year was found."
0672016,Simi Valley city,CA,126343,unknown,,unknown,not_adopted_by2012,0.0,adopted_year_unknown,,secondary,Simi Valley uses SeeClickFix for citizen service requests; no specific launch year was found.
2915670,Columbia city,MO,126307,2020,2020.0,year_found,not_in_obyrne,,adopted_year_verified,,news,"Boone County (which serves Columbia MO) launched a 311 non-emergency call line in November 2020, per KOMU news."
4856348,Pearland city,TX,125996,unknown,,unknown,not_in_obyrne,,adopted_year_unknown,,official,"Pearland uses the ""Connect2Pearland"" app (CitySourced) for citizen service requests; no specific launch year was found."
3825700,Fargo city,ND,125986,unknown,,unknown,not_in_obyrne,,adopted_year_unknown,,official,"Fargo uses a ""FargoOne"" service platform for non-emergency requests; no specific 311 launch year was found."
0681666,Vallejo city,CA,125894,2013,2013.0,year_found,unclear,,adopted_year_verified,,secondary,"Vallejo adopted SeeClickFix in late 2013; Code Enforcement began using it as its 311 platform then, per a SeeClickFix case study."
4202000,Allentown city,PA,125727,2025,2025.0,year_found,not_adopted_by2012,0.0,adopted_year_verified,,news,"Allentown unveiled a new 311 system on November 7, 2025, per WFMZ and an official city press release."
4801000,Abilene city,TX,125417,unknown,,unknown,not_adopted_by2012,0.0,adopted_year_unknown,,official,Abilene uses SeeClickFix and direct department lines for service requests; no formal 311 system or launch year was found.
0616000,Concord city,CA,125286,unknown,,unknown,not_adopted_by2012,0.0,adopted_year_unknown,,official,"Concord CA uses the ""Concord Connect"" app (PublicStuff) for citizen service requests; no specific launch year was found."
0803455,Arvada city,CO,124343,unknown,,unknown,not_adopted_by2012,0.0,adopted_year_unknown,,official,"Arvada uses ""Ask Arvada"" 311 CRM (Comcate platform) for service requests; no specific launch year was found."
0606000,Berkeley city,CA,124205,2009,2009.0,year_found,adopted_by2012,1.0,adopted_year_verified,,news,"The Berkeley Daily Planet (November 25, 2009) reports the City of Berkeley officially launched its 311 call center at the November 17, 2009 City Council meeting after a pilot period in which 65,000 calls were received."
2603000,Ann Arbor city,MI,123611,2014,2014.0,year_found,not_adopted_by2012,0.0,adopted_year_verified,,news,"""A2 Fix It"" (SeeClickFix) went online in July 2014, per Ann Arbor Observer reporting."
2935000,Independence city,MO,122899,unknown,,unknown,not_adopted_by2012,0.0,adopted_year_unknown,,official,"Independence MO uses the ""IndepNow"" app (CitySourced) for citizen service requests; no specific launch year was found."
